{
  "$schema": "../schemas/adapter-manifest.schema.json",
  "schema": 1,
  "name": "example",
  "language": "example",
  "command": ["./adapter"],
  "build": ["make", "adapter"],
  "cwd": ".",
  "capabilities": [
    "challenge.parse",
    "challenge.format",
    "credential.parse",
    "credential.format",
    "receipt.parse",
    "receipt.format",
    "base64url.encode",
    "base64url.decode",
    "challenge.id",
    "http.payment_request"
  ]
}
