{
  "$schema": "../../schemas/adapter-manifest.schema.json",
  "schema": 1,
  "name": "typescript",
  "language": "typescript",
  "command": [
    "npx",
    "tsx",
    "golden/adapter.ts"
  ],
  "cwd": "../..",
  "capabilities": [
    "challenge.parse",
    "challenge.format",
    "credential.parse",
    "credential.format",
    "receipt.parse",
    "receipt.format",
    "base64url.encode",
    "base64url.decode",
    "challenge.id"
  ]
}
